preference_code,trigger_keywords,preferred_brand,preferred_category,lx_score,kcc_score,etc_score,recommend_reason,context_line
sound,소음|시끄럽다|방음,LX지인,이중창,95,82,55,소음이 고민이시면 LX 방음 특화 라인이 더 안정적이에요.,아까 소음이 신경 쓰인다고 하셨잖아요.
insulation,단열|춥다|추위|바람,LX지인,이중창,96,84,58,단열이 우선이면 1등급 단열 성능을 갖춘 LX 라인이 잘 맞아요.,아까 단열이 가장 걱정이라고 하셨잖아요.
condensation,결로|물방울|곰팡이,LX지인,이중창,94,83,54,결로를 줄이려면 기밀성과 단열 성능이 높은 LX 라인이 유리해요.,아까 결로가 가장 불편하다고 하셨잖아요.
ventilation,환기|공기|환풍,KCC글라스,슬라이딩,82,88,60,환기를 자주 하시면 개폐 부담이 적은 KCC 실속형 조합도 잘 맞아요.,아까 환기가 중요하다고 하셨잖아요.
view,뷰|조망|개방감,LX지인,폴딩도어,93,78,52,개방감을 원하시면 LX 확장형 프리미엄 라인이 만족도가 높아요.,아까 뷰와 개방감을 중요하게 보셨잖아요.
budget,가격|예산|가성비|저렴,KCC글라스,이중창,76,90,86,예산을 우선 보시면 KCC 쪽이 성능과 가격 균형이 가장 무난해요.,아까 예산이 중요하다고 하셨잖아요.
